{
  "$id": "https://bigbirdreturns.github.io/undercast/schema/clifford-number-hr-algorithmic-discipline-lane.schema.json",
  "$schema": "https://json-schema.org/draft/2020-12/schema",
  "additionalProperties": false,
  "properties": {
    "authority": {
      "additionalProperties": false,
      "properties": {
        "ai_caused_chloe_moffat_death_claims_allowed": {
          "const": false
        },
        "canonical_product_effects_allowed": {
          "const": false
        },
        "control_adoption_allowed": {
          "const": false
        },
        "dissonance_purge_universal_claims_allowed": {
          "const": false
        },
        "employer_liability_findings_allowed": {
          "const": false
        },
        "employer_specific_causation_findings_allowed": {
          "const": false
        },
        "final_coroner_conclusion_claims_allowed": {
          "const": false
        },
        "graph_effects_allowed": {
          "const": false
        },
        "individual_culpability_findings_allowed": {
          "const": false
        },
        "legal_conclusions_allowed": {
          "const": false
        },
        "named_vendor_misuse_findings_allowed": {
          "const": false
        },
        "parent_wave_mutation_allowed": {
          "const": false
        },
        "private_source_publication_allowed": {
          "const": false
        },
        "protected_activity_classification_claims_allowed": {
          "const": false
        },
        "publication_effects_allowed": {
          "const": false
        },
        "universal_prevalence_findings_allowed": {
          "const": false
        },
        "victim_character_inferences_allowed": {
          "const": false
        }
      },
      "required": [
        "ai_caused_chloe_moffat_death_claims_allowed",
        "canonical_product_effects_allowed",
        "control_adoption_allowed",
        "dissonance_purge_universal_claims_allowed",
        "employer_liability_findings_allowed",
        "employer_specific_causation_findings_allowed",
        "final_coroner_conclusion_claims_allowed",
        "graph_effects_allowed",
        "individual_culpability_findings_allowed",
        "legal_conclusions_allowed",
        "named_vendor_misuse_findings_allowed",
        "parent_wave_mutation_allowed",
        "private_source_publication_allowed",
        "protected_activity_classification_claims_allowed",
        "publication_effects_allowed",
        "universal_prevalence_findings_allowed",
        "victim_character_inferences_allowed"
      ],
      "type": "object"
    },
    "findings": {
      "items": {
        "additionalProperties": false,
        "properties": {
          "claim": {
            "minLength": 1,
            "type": "string"
          },
          "id": {
            "pattern": "^HRDA-0[1-6]-F0[1-4]$",
            "type": "string"
          },
          "limits": {
            "items": {
              "minLength": 1,
              "type": "string"
            },
            "minItems": 1,
            "type": "array"
          },
          "source_ids": {
            "items": {
              "minLength": 1,
              "type": "string"
            },
            "minItems": 1,
            "type": "array",
            "uniqueItems": true
          },
          "status": {
            "enum": [
              "bounded_synthesis",
              "independently_supported_scoped",
              "legal_boundary_recovered",
              "normative_control_not_adopted",
              "vendor_boundary_recovered"
            ]
          }
        },
        "required": [
          "claim",
          "id",
          "limits",
          "source_ids",
          "status"
        ],
        "type": "object"
      },
      "maxItems": 4,
      "minItems": 4,
      "type": "array"
    },
    "lane_id": {
      "pattern": "^HRDA-0[1-6]$",
      "type": "string"
    },
    "object_type": {
      "const": "algorithmic_discipline_lane"
    },
    "observations": {
      "items": {
        "additionalProperties": false,
        "properties": {
          "claim": {
            "minLength": 1,
            "type": "string"
          },
          "id": {
            "pattern": "^HRDA-0[1-6]-O0[1-6]$",
            "type": "string"
          },
          "limits": {
            "items": {
              "minLength": 1,
              "type": "string"
            },
            "minItems": 1,
            "type": "array"
          },
          "source_ids": {
            "items": {
              "minLength": 1,
              "type": "string"
            },
            "minItems": 1,
            "type": "array",
            "uniqueItems": true
          },
          "state": {
            "minLength": 1,
            "type": "string"
          }
        },
        "required": [
          "claim",
          "id",
          "limits",
          "source_ids",
          "state"
        ],
        "type": "object"
      },
      "maxItems": 6,
      "minItems": 6,
      "type": "array"
    },
    "open_questions": {
      "items": {
        "minLength": 1,
        "type": "string"
      },
      "maxItems": 6,
      "minItems": 6,
      "type": "array",
      "uniqueItems": true
    },
    "schema_version": {
      "const": 1
    },
    "terminal_state": {
      "minLength": 1,
      "type": "string"
    },
    "title": {
      "minLength": 1,
      "type": "string"
    }
  },
  "required": [
    "authority",
    "findings",
    "lane_id",
    "object_type",
    "observations",
    "open_questions",
    "schema_version",
    "terminal_state",
    "title"
  ],
  "title": "Clifford Number HR algorithmic-discipline lane",
  "type": "object"
}
