{
  "authority": {
    "ai_caused_chloe_moffat_death_claims_allowed": false,
    "canonical_product_effects_allowed": false,
    "control_adoption_allowed": false,
    "dissonance_purge_universal_claims_allowed": false,
    "employer_liability_findings_allowed": false,
    "employer_specific_causation_findings_allowed": false,
    "final_coroner_conclusion_claims_allowed": false,
    "graph_effects_allowed": false,
    "individual_culpability_findings_allowed": false,
    "legal_conclusions_allowed": false,
    "named_vendor_misuse_findings_allowed": false,
    "parent_wave_mutation_allowed": false,
    "private_source_publication_allowed": false,
    "protected_activity_classification_claims_allowed": false,
    "publication_effects_allowed": false,
    "universal_prevalence_findings_allowed": false,
    "victim_character_inferences_allowed": false
  },
  "findings": [
    {
      "claim": "Algorithmic surveillance can convert complex work into crude traces whose decontextualization erodes trust and fairness and shapes compliance, alteration, or avoidance.",
      "id": "HRDA-02-F01",
      "limits": [
        "One crowdwork platform and self-report design."
      ],
      "source_ids": [
        "van-zoonen-2026-decontextualization"
      ],
      "status": "independently_supported_scoped"
    },
    {
      "claim": "Monitoring can worsen psychosocial risk even before a formal adverse decision because pace, privacy, isolation, autonomy, and uncertainty are themselves working conditions.",
      "id": "HRDA-02-F02",
      "limits": [
        "Association and aggregate evidence; no individual diagnosis."
      ],
      "source_ids": [
        "euosha-2025-aiwm-facts",
        "ravid-2023-epm-meta"
      ],
      "status": "independently_supported_scoped"
    },
    {
      "claim": "A score can be descriptively accurate about a trace while being substantively wrong about the work, motive, disability, safety context, or protected activity that produced it.",
      "id": "HRDA-02-F03",
      "limits": [
        "No named system error is adjudicated."
      ],
      "source_ids": [
        "van-zoonen-2026-decontextualization",
        "ico-2026-monitoring-workers",
        "eeoc-ai-disability-guidance-2022"
      ],
      "status": "bounded_synthesis"
    },
    {
      "claim": "The receipt must attach context before escalation rather than asking the worker to reconstruct context only after access, pay, duties, or reputation are already constrained.",
      "id": "HRDA-02-F04",
      "limits": [
        "Proposed estate control, not current universal law."
      ],
      "source_ids": [
        "ico-2026-monitoring-workers",
        "ico-2026-automated-decisions"
      ],
      "status": "normative_control_not_adopted"
    }
  ],
  "lane_id": "HRDA-02",
  "object_type": "algorithmic_discipline_lane",
  "observations": [
    {
      "claim": "The 2026 Human Relations study defines decontextualization as algorithms failing to account adequately for broader work context while reducing labor to machine-readable traces.",
      "id": "HRDA-02-O01",
      "limits": [
        "Perceived decontextualization in crowdwork."
      ],
      "source_ids": [
        "van-zoonen-2026-decontextualization"
      ],
      "state": "observed_peer_reviewed_mechanism"
    },
    {
      "claim": "In that study, algorithmic surveillance was associated with lower trust and fairness and higher privacy concern, which related to compliance, alteration, or avoidance intentions.",
      "id": "HRDA-02-O02",
      "limits": [
        "Intentions are not actual misconduct or exit."
      ],
      "source_ids": [
        "van-zoonen-2026-decontextualization"
      ],
      "state": "observed_peer_reviewed_result"
    },
    {
      "claim": "EU-OSHA reports that over half of workers in environments with automated allocation or monitoring experienced severe time pressure and overload, with substantial isolation, poor communication and reduced autonomy.",
      "id": "HRDA-02-O03",
      "limits": [
        "Cross-sectional survey associations."
      ],
      "source_ids": [
        "euosha-2025-aiwm-facts"
      ],
      "state": "observed_official_safety_summary"
    },
    {
      "claim": "The same summary reports stress, depression or anxiety among 31% of workers where digital tools automatically allocate tasks or time and 34% where tools monitor work or behavior.",
      "id": "HRDA-02-O04",
      "limits": [
        "Not an individual causal estimate."
      ],
      "source_ids": [
        "euosha-2025-aiwm-facts"
      ],
      "state": "observed_official_safety_summary"
    },
    {
      "claim": "ICO guidance inventories screenshots, webcams, timekeeping, keystrokes, productivity, internet activity, location and audio as monitoring surfaces and says excessive monitoring can undermine privacy and mental wellbeing.",
      "id": "HRDA-02-O05",
      "limits": [
        "Guidance under review; no case finding."
      ],
      "source_ids": [
        "ico-2026-monitoring-workers"
      ],
      "state": "observed_official_guidance"
    },
    {
      "claim": "EEOC technical assistance recognizes that AI and software tools used to monitor or assess workers can create disability screen-out and accommodation risks.",
      "id": "HRDA-02-O06",
      "limits": [
        "Technical assistance, not liability ruling."
      ],
      "source_ids": [
        "eeoc-ai-disability-guidance-2022"
      ],
      "state": "observed_official_guidance"
    }
  ],
  "open_questions": [
    "what_context_is_missing",
    "which_trace_is_treated_as_construct",
    "what_disability_or_safety_context_exists",
    "what_privacy_and_stress_risk_was_assessed",
    "who_can_attach_contrary_evidence",
    "when_context_arrives_relative_to_adverse_action"
  ],
  "schema_version": 1,
  "terminal_state": "decontextualization_and_psychosocial_mechanisms_recovered_named_worker_effect_open",
  "title": "Decontextualization, psychosocial load, and context-bearing review"
}
